{
  "$schema": "./model-manifest.schema.json",
  "id": "qwen3-asr-0.6b-mlx-8bit",
  "source": {
    "repository": "Qwen/Qwen3-ASR-0.6B",
    "revision": "5eb144179a02acc5e5ba31e748d22b0cf3e303b0",
    "license": "Apache-2.0"
  },
  "conversion": {
    "repository": "mlx-community/Qwen3-ASR-0.6B-8bit",
    "revision": "89e96d92ba34aca20b3e29fb10cc284097d1219f",
    "license": "Apache-2.0",
    "quantization": {
      "mode": "affine",
      "bits": 8,
      "group_size": 64
    }
  },
  "artifacts": [
    {
      "path": "config.json",
      "bytes": 7187,
      "sha256": "5d104a945fed08728ab010f12bf3ce5ab4d0794bba276d81bff5bd83ae9d2be0"
    },
    {
      "path": "preprocessor_config.json",
      "bytes": 330,
      "sha256": "45e120a4eda2c20c5d7f2ea9354e63536bf35e27aa573fb7cdf78017b378770d"
    },
    {
      "path": "model.safetensors",
      "bytes": 1006229426,
      "sha256": "b5bfe4abc1b4c6e58b633096682ec2b6297298add1527119936107d211adf0e8"
    },
    {
      "path": "model.safetensors.index.json",
      "bytes": 71815,
      "sha256": "caa32ece76c395ba241533eb4aceb0efbc72488ef3d8d2fd3c677ce068dad57d"
    },
    {
      "path": "tokenizer_config.json",
      "bytes": 12487,
      "sha256": "4942d005604266809309cabc9f4e9cb89ce855d59b14681fdc0e1cc62ea26c4c"
    },
    {
      "path": "vocab.json",
      "bytes": 2776833,
      "sha256": "ca10d7e9fb3ed18575dd1e277a2579c16d108e32f27439684afa0e10b1440910"
    },
    {
      "path": "merges.txt",
      "bytes": 1671853,
      "sha256": "8831e4f1a044471340f7c0a83d7bd71306a5b867e95fd870f74d0c5308a904d5"
    },
    {
      "path": "chat_template.json",
      "bytes": 1161,
      "sha256": "75a8cfca24f00de72d796fbfed6858fc9614ef3dabd8696684cc3bc03a9c58ff"
    },
    {
      "path": "generation_config.json",
      "bytes": 142,
      "sha256": "1da527824d81e07118facff437e03f2e24a23311e3bdeb2368973fe77e5f275c"
    }
  ],
  "architecture": {
    "sample_rate_hz": 16000,
    "mel_bins": 128,
    "audio_encoder_layers": 18,
    "audio_state": 896,
    "audio_attention_heads": 14,
    "audio_output_dim": 1024,
    "text_decoder_layers": 28,
    "text_hidden_size": 1024,
    "text_attention_heads": 16,
    "text_key_value_heads": 8,
    "text_head_dim": 128,
    "vocabulary_size": 151936,
    "audio_token_id": 151676,
    "audio_start_token_id": 151669,
    "audio_end_token_id": 151670
  },
  "expected_layout": {
    "tensor_count": 1005,
    "bfloat16_tensors": 808,
    "uint32_tensors": 197,
    "affine_8bit_modules": 197
  }
}
